{
  "schema_version": "run_state_v0",
  "run_id": "ALPHA_RUN_20260418T204224135742Z_7558d8",
  "task_class": "bounded_change",
  "state": "CLOSURE_ACCEPTED",
  "target_surface": {
    "status": "ATTESTED",
    "identity": "autodetected_python_worktree",
    "baseline_relation": "autodetected_python_baseline"
  },
  "doctor": {
    "status": "PASS",
    "blocking_failure_classes": []
  },
  "integrity": {
    "status": "PASS",
    "exact_task_identity_ok": true,
    "bootstrap_provenance_ok": true,
    "bootstrap_provenance_reason": "CONTROLLED_BOOTSTRAP_CONFIRMED"
  },
  "execution": {
    "status": "COMPLETED",
    "artifact_bundle_present": true
  },
  "proof_bundle": {
    "status": "COMPLETE",
    "missing_sections": [],
    "structural_status": "COMPLETE",
    "semantic_status": "SUFFICIENT",
    "semantically_insufficient_sections": [],
    "semantic_next_safe_step": ""
  },
  "closure": {
    "status": "ACCEPTED",
    "blocking_reason": "",
    "next_allowed_transition": "NONE",
    "narrow_next_safe_step": "NONE",
    "missing_sections": []
  },
  "recovery": {
    "status": "NOT_REQUIRED",
    "reverification_complete": false
  },
  "next_safe_step": "NONE"
}
